{
  "cup_type": "xdripper",
  "dose": 17,
  "grinder": { "size": 50, "rpm": 90 },
  "temperature": 93,
  "pattern": "spiral",
  "vibration": "none",
  "flow_rate": 3.0,
  "pours": [
    {
      "volume": 50,
      "post_wait": 45,
      "temperature": 95,
      "pattern": "center",
      "vibration": "before"
    },
    { "volume": 55, "post_wait": 30 },
    { "volume": 55, "post_wait": 30 },
    { "volume": 50, "post_wait": 30, "flow_rate": 3.3 },
    { "volume": 40, "post_wait": 25, "temperature": 91 },
    { "volume": 22, "post_wait": 0, "temperature": 89 }
  ]
}
